type	clinical_trial_id	title	last_update_posted	recruitment_status	publication_id	queried_project_id
clinical_trial	NCT04514341	Implementing a Multilevel Intervention to Accelerate Colorectal Cancer Screening and Follow-up	14-Aug-2020	Not yet recruiting	33121536	UG3CA233229
clinical_trial	NCT04514341	Implementing a Multilevel Intervention to Accelerate Colorectal Cancer Screening and Follow-up	14-Aug-2020	Not yet recruiting	33121536	UH3CA233229
clinical_trial	NCT04763915	Improving Care After Inherited Cancer Testing (IMPACT)	2-Mar-2022	Recruiting	34645413	U01CA254832
clinical_trial	NCT04428905	Self-Management Survivorship Care in Stage I-III Non-small Cell Lung Cancer or Colorectal Cancer	7-Apr-2022	Recruiting	33415649	R01CA249501
clinical_trial	NCT04867850	Effect of Behavioral Nudges on Serious Illness Conversation Documentation (SPP2)	14-Sep-2021	Recruiting	34563227	P50CA244690
clinical_trial	NCT04737031	Improving Tobacco Treatment Rates for Outpatient Cancer Patients Who Smoke (SPP1)	11-Jan-2022	Recruiting	34266468	P50CA244690
clinical_trial	NCT05006482	Geriatric Evaluation and Management With Survivorship Health Education (GEMS) for Older Survivors of Cancer	10-Feb-2022	Not yet recruiting	35292232	R01CA249467
clinical_trial	NCT04406714	Scaling CRC Screening Through Outreach, Referral, and Engagement (SCORE) (SCORE)	12-May-2021	Recruiting	34620250	UG3CA233251
clinical_trial	NCT04406714	Scaling CRC Screening Through Outreach, Referral, and Engagement (SCORE) (SCORE)	12-May-2021	Recruiting	34620250	UH3CA233251
clinical_trial	NCT03264898	Comparative Effectiveness of FITs With Colonoscopy	22-May-2018	Recruiting	33974994	R01CA215034
clinical_trial	NCT03278340	Using Technology to Scale-Up an Occupational Sun Protection Policy Program (SSW-T)	9-Jul-2021	Enrolling by invitation	32942054	R01CA210259
clinical_trial	NCT03592771	THRIVE Breast Cancer App Study (THRIVE)	18-Jan-2022	Active, not recruiting	31856812	R01CA218155
clinical_trial	NCT04427527	Accelerating Colorectal Cancer Screening Through Implementation Science in Appalachia (ACCSIS)	3-May-2021	Recruiting	34011410	UH3CA233282
clinical_trial	NCT00788671	Levonorgestrel-Releasing Intrauterine System in Treating Patients With Complex Atypical Hyperplasia or Grade I Endometrial Cancer	8-Oct-2021	Active, not recruiting	32805208	P50CA098258
clinical_trial	NCT02451423	Neoadjuvant Atezolizumab in Localized Bladder Cancer	6-Apr-2022	Recruiting	32497499	U01CA233100
clinical_trial	NCT02451423	Neoadjuvant Atezolizumab in Localized Bladder Cancer	6-Apr-2022	Recruiting	32497499	U01CA244452
clinical_trial	NCT02451423	Neoadjuvant Atezolizumab in Localized Bladder Cancer	6-Apr-2022	Recruiting	32497499	R01CA194511
clinical_trial	NCT03892967	Enhanced, EHR-facilitated Cancer Symptom Control (E2C2) Pragmatic Clinical Trial (E2C2)	31-Jan-2022	Recruiting	32503661	UM1CA233033
clinical_trial	NCT01727076	Recombinant Interleukin-15 in Treating Patients With Advanced Melanoma, Kidney Cancer, Non-small Cell Lung Cancer, or Squamous Cell Head and Neck Cancer	15-Sep-2017	Completed	29203590	UM1CA154967
clinical_trial	NCT01727076	Recombinant Interleukin-15 in Treating Patients With Advanced Melanoma, Kidney Cancer, Non-small Cell Lung Cancer, or Squamous Cell Head and Neck Cancer	15-Sep-2017	Completed	30045932	UM1CA154967
clinical_trial	NCT01628913	Efficacy and Safety of BEZ235 Compared to Everolimus in Patients With Advanced Pancreatic Neuroendocrine Tumors	7-Apr-2016	Terminated	29242283	P50CA174521
clinical_trial	NCT01576172	Abiraterone Acetate and Prednisone With or Without Veliparib in Treating Patients With Metastatic Castration-Resistant Prostate Cancer	12-Nov-2020	Completed	29261439	P50CA186786
clinical_trial	NCT02435849	Study of Efficacy and Safety of CTL019 in Pediatric ALL Patients (ELIANA)	31-Mar-2022	Active, not recruiting	29385370	P01CA214278
clinical_trial	NCT02435849	Study of Efficacy and Safety of CTL019 in Pediatric ALL Patients (ELIANA)	31-Mar-2022	Active, not recruiting	31606419	P01CA214278
clinical_trial	NCT02435849	Study of Efficacy and Safety of CTL019 in Pediatric ALL Patients (ELIANA)	31-Mar-2022	Active, not recruiting	33496754	P01CA214278
clinical_trial	NCT01295827	Study of Pembrolizumab (MK-3475) in Participants With Progressive Locally Advanced or Metastatic Carcinoma, Melanoma, or Non-small Cell Lung Carcinoma (P07990/MK-3475-001/KEYNOTE-001) (KEYNOTE-001)	13-Dec-2019	Completed	29486723	R01CA205426
clinical_trial	NCT02957526	Web-Base App To Improve Aromatase Inhibitor Adherence (AETAPP)	19-Jul-2018	Completed	29492753	R01CA218155
clinical_trial	NCT00033631	Radiation Therapy in Treating Patients With Stage II Prostate Cancer	29-Jul-2021	Active, not recruiting	29543933	U24CA180803
clinical_trial	NCT02135406	CART-19 for Multiple Myeloma	13-Feb-2018	Completed	29669947	P01CA214278
clinical_trial	NCT01578239	A Study Comparing Treatment With 177Lu-DOTA0-Tyr3-Octreotate to Octreotide LAR in Patients With Inoperable, Progressive, Somatostatin Receptor Positive Midgut Carcinoid Tumours (NETTER-1)	4-Apr-2022	Completed	29878866	P50CA174521
clinical_trial	NCT01578239	A Study Comparing Treatment With 177Lu-DOTA0-Tyr3-Octreotate to Octreotide LAR in Patients With Inoperable, Progressive, Somatostatin Receptor Positive Midgut Carcinoid Tumours (NETTER-1)	4-Apr-2022	Completed	32123969	P50CA174521
clinical_trial	NCT02546167	CART-BCMA Cells for Multiple Myeloma	4-Aug-2020	Completed	29899820	P01CA214278
clinical_trial	NCT02546167	CART-BCMA Cells for Multiple Myeloma	4-Aug-2020	Completed	30896447	P01CA214278
clinical_trial	NCT01626495	Phase I/IIA Study of CART19 Cells for Patients With Chemotherapy Resistant or Refractory CD19+ Leukemia and Lymphoma (Pedi CART19)	23-Mar-2020	Completed	30178481	P01CA214278
clinical_trial	NCT02303990	RADVAX: A Stratified Phase I Trial of Pembrolizumab With Hypofractionated Radiotherapy in Patients With Advanced and Metastatic Cancers	12-May-2021	Completed	30318516	P01CA210944
clinical_trial	NCT01302834	Radiation Therapy With Cisplatin or Cetuximab in Treating Patients With Oropharyngeal Cancer	23-Feb-2021	Unknown	30449625	U24CA180803
clinical_trial	NCT02267603	Pembrolizumab in Treating Patients With Advanced Merkel Cell Cancer	29-Mar-2022	Completed	30726175	UM1CA154967
clinical_trial	NCT02267603	Pembrolizumab in Treating Patients With Advanced Merkel Cell Cancer	29-Mar-2022	Completed	33879601	UM1CA154967
clinical_trial	NCT03478397	Evaluation of a mHealth Intervention to Increase Adherence to Triage of Self-collected HPV+ Women (ATICA Project) (ATICA)	6-Apr-2021	Completed	30808379	R01CA218306
clinical_trial	NCT01623349	Phase I Study of the Oral PI3kinase Inhibitor BKM120 or BYL719 and the Oral PARP Inhibitor Olaparib in Patients With Recurrent Triple Negative Breast Cancer or High Grade Serous Ovarian Cancer	10-Feb-2021	Completed	30880072	R01CA226776
clinical_trial	NCT01623349	Phase I Study of the Oral PI3kinase Inhibitor BKM120 or BYL719 and the Oral PARP Inhibitor Olaparib in Patients With Recurrent Triple Negative Breast Cancer or High Grade Serous Ovarian Cancer	10-Feb-2021	Completed	32164626	R01CA226776
clinical_trial	NCT00750269	Stereotactic Body Radiation Therapy in Treating Patients With Stage I Non-Small Cell Lung Cancer	7-May-2019	Unknown	30943123	U24CA180803
clinical_trial	NCT00346164	Observation, Radiation Therapy, Combination Chemotherapy, and/or Surgery in Treating Young Patients With Soft Tissue Sarcoma	19-Aug-2021	Active, not recruiting	30954717	U24CA180803
clinical_trial	NCT00346164	Observation, Radiation Therapy, Combination Chemotherapy, and/or Surgery in Treating Young Patients With Soft Tissue Sarcoma	19-Aug-2021	Active, not recruiting	31786124	U24CA180803
clinical_trial	NCT00346164	Observation, Radiation Therapy, Combination Chemotherapy, and/or Surgery in Treating Young Patients With Soft Tissue Sarcoma	19-Aug-2021	Active, not recruiting	33548339	U10CA180899
clinical_trial	NCT00346164	Observation, Radiation Therapy, Combination Chemotherapy, and/or Surgery in Treating Young Patients With Soft Tissue Sarcoma	19-Aug-2021	Active, not recruiting	33548339	U24CA180803
clinical_trial	NCT01747486	Dose Optimization Trial of CD19 Redirected Autologous T Cells	30-Aug-2019	Completed	31076448	P01CA214278
clinical_trial	NCT01029366	CART19 to Treat B-Cell Leukemia or Lymphoma That Are Resistant or Refractory to Chemotherapy	26-Jun-2019	Completed	31076448	P01CA214278
clinical_trial	NCT01029366	CART19 to Treat B-Cell Leukemia or Lymphoma That Are Resistant or Refractory to Chemotherapy	26-Jun-2019	Completed	31815579	P01CA214278
clinical_trial	NCT01821729	Proton w/FOLFIRINOX-Losartan for Pancreatic Cancer	25-Sep-2020	Active, not recruiting	31145418	R01CA208205
clinical_trial	NCT01821729	Proton w/FOLFIRINOX-Losartan for Pancreatic Cancer	25-Sep-2020	Active, not recruiting	31145418	U01CA224348
clinical_trial	NCT02595866	Testing the Addition of an Experimental Medication MK-3475 (Pembrolizumab) to Usual Anti-Retroviral Medications in Patients With HIV and Cancer	11-Mar-2022	Recruiting	31154457	UM1CA154967
clinical_trial	NCT00920621	Randomized Trial: Maternal Vitamin D Supplementation to Prevent Childhood Asthma (VDAART) (VDAART)	9-Mar-2022	Active, not recruiting	31155658	U01CA164973
clinical_trial	NCT03639350	The Healthy Diet and Lifestyle Study (HDL)	21-Aug-2018	Completed	31226790	U01CA164973
clinical_trial	NCT01277757	Akt Inhibitor MK2206 in Treating Patients With Advanced Breast Cancer	19-Dec-2018	Completed	31277699	R01CA226776
clinical_trial	NCT00822120	S0816 Fludeoxyglucose F 18-PET/CT Imaging and Combination Chemotherapy With or Without Additional Chemotherapy and G-CSF in Treating Patients With Stage III or Stage IV Hodgkin Lymphoma	26-Jan-2022	Active, not recruiting	31331918	U24CA180803
clinical_trial	NCT02243579	Pembrolizumab in Treating Patients With Relapsed or Refractory Stage IB-IVB Mycosis Fungoides or Sezary Syndrome	20-Sep-2019	Completed	31532724	UM1CA154967
clinical_trial	NCT02243579	Pembrolizumab in Treating Patients With Relapsed or Refractory Stage IB-IVB Mycosis Fungoides or Sezary Syndrome	20-Sep-2019	Completed	34795254	U2CCA233195
clinical_trial	NCT02243579	Pembrolizumab in Treating Patients With Relapsed or Refractory Stage IB-IVB Mycosis Fungoides or Sezary Syndrome	20-Sep-2019	Completed	34795254	U2CCA233238
clinical_trial	NCT02243579	Pembrolizumab in Treating Patients With Relapsed or Refractory Stage IB-IVB Mycosis Fungoides or Sezary Syndrome	20-Sep-2019	Completed	34795254	UM1CA154967
clinical_trial	NCT01522443	Study of Cabozantinib (XL184) Versus Mitoxantrone Plus Prednisone in Men With Previously Treated Symptomatic Castration-resistant Prostate Cancer (COMET-2)	23-May-2018	Terminated	31556911	U01CA233046
clinical_trial	NCT01522443	Study of Cabozantinib (XL184) Versus Mitoxantrone Plus Prednisone in Men With Previously Treated Symptomatic Castration-resistant Prostate Cancer (COMET-2)	23-May-2018	Terminated	33258687	U01CA233046
clinical_trial	NCT01522443	Study of Cabozantinib (XL184) Versus Mitoxantrone Plus Prednisone in Men With Previously Treated Symptomatic Castration-resistant Prostate Cancer (COMET-2)	23-May-2018	Terminated	34420143	U01CA233046
clinical_trial	NCT01343043	A Pilot Study of Genetically Engineered NY-ESO-1 Specific NY-ESO-1&#7580;&#178;&#8309;&#8313;T in HLA-A2+ Patients With Synovial Sarcoma (NY-ESO-1)	30-Jun-2021	Completed	31651363	P01CA214278
clinical_trial	NCT01307631	Akt Inhibitor MK2206 in Treating Patients With Recurrent or Advanced Endometrial Cancer	11-Feb-2022	Completed	31714586	P50CA098258
clinical_trial	NCT02030847	Study of Redirected Autologous T Cells Engineered to Contain Anti-CD19 Attached to TCR and 4-1BB Signaling Domains in Patients With Chemotherapy Resistant or Refractory Acute Lymphoblastic Leukemia	30-Aug-2019	Completed	31815579	P01CA214278
clinical_trial	NCT00533949	High-Dose or Standard-Dose Radiation Therapy and Chemotherapy With or Without Cetuximab in Treating Patients With Newly Diagnosed Stage III Non-Small Cell Lung Cancer That Cannot Be Removed by Surgery	5-Feb-2020	Unknown	31841363	U24CA180803
clinical_trial	NCT02092324	Ruxolitinib Phosphate in Treating Patients With Chronic Neutrophilic Leukemia or Atypical Chronic Myeloid Leukemia	16-Nov-2020	Completed	31880950	U54CA224019
clinical_trial	NCT01677910	TELESTAR (Telotristat Etiprate for Somatostatin Analogue Not Adequately Controlled Carcinoid Syndrome)	27-Feb-2018	Completed	32146619	P50CA174521
clinical_trial	NCT02063659	Telotristat Etiprate for Carcinoid Syndrome Therapy (TELECAST)	26-Feb-2018	Completed	32146619	P50CA174521
clinical_trial	NCT00002874	Radiation Therapy With or Without Bicalutamide for Recurrent pT3N0 Prostate Cancer After Radical Prostatectomy	3-Mar-2022	Unknown	32215583	P50CA186786
clinical_trial	NCT02315612	Anti-CD22 Chimeric Receptor T Cells in Pediatric and Young Adults With Recurrent or Refractory CD22-expressing B Cell Malignancies	11-Apr-2022	Recruiting	32286905	U01CA224766
clinical_trial	NCT01363206	Granulocyte Macrophage-Colony Stimulating Factor and Ipilimumab as Therapy in Melanoma (GIPI)	19-Mar-2020	Completed	32376721	U01CA233100
clinical_trial	NCT00064129	Ipilimumab and Sargramostim in Treating Patients With Metastatic Prostate Cancer	30-Jul-2020	Completed	32376721	U01CA233100
clinical_trial	NCT03799432	Collaborative Organizational Approach to Selecting and Tailoring Implementation Strategies (COAST-IS)	8-Jan-2021	Active, not recruiting	32391524	P50CA244431
clinical_trial	NCT00557193	Combination Chemotherapy With or Without Lestaurtinib in Treating Younger Patients With Newly Diagnosed Acute Lymphoblastic Leukemia	25-Mar-2022	Active, not recruiting	32414848	U01CA232486
clinical_trial	NCT01454297	Relating Clinical Outcomes in Multiple Myeloma to Personal Assessment of Genetic Profile (CoMMpass)	16-Aug-2018	Active, not recruiting	32471990	U2CCA233303
clinical_trial	NCT02296684	Immunotherapy With MK-3475 in Surgically Resectable Head and Neck Squamous Cell Carcinoma	30-Aug-2021	Active, not recruiting	32665297	U24CA237719
clinical_trial	NCT02296684	Immunotherapy With MK-3475 in Surgically Resectable Head and Neck Squamous Cell Carcinoma	30-Aug-2021	Active, not recruiting	32665297	U01CA209936
clinical_trial	NCT00902044	Her2 Chimeric Antigen Receptor Expressing T Cells in Advanced Sarcoma	30-Dec-2021	Active, not recruiting	32669548	U54CA232568
clinical_trial	NCT01191060	Study Comparing Conventional Dose Combination RVD to High-Dose Treatment With ASCT in the Initial Myeloma up to 65 Years (IFM/DFCI2009)	18-Apr-2019	Completed	32687451	P01CA155258
clinical_trial	NCT02180867	Radiation Therapy With or Without Combination Chemotherapy or Pazopanib Before Surgery in Treating Patients With Newly Diagnosed Non-rhabdomyosarcoma Soft Tissue Sarcomas That Can Be Removed by Surgery	11-Apr-2022	Active, not recruiting	32702309	U24CA180803
clinical_trial	NCT04358276	Technology-Enabled Activation of Skin Cancer Screening for Stem Cell Transplant Survivors and Their Primary Care Providers, TEACH Study	21-Feb-2022	Recruiting	32746799	R01CA249460
clinical_trial	NCT00500591	Prevalence of Endometrial Abnormalities In Obese Women	25-Feb-2021	Active, not recruiting	32835719	P50CA098258
clinical_trial	NCT03051659	A Randomized Phase II Study Of Eribulin Mesylate With or Without Pembrolizumab For Metastatic Hormone Receptor Positive Breast Cancer	21-Dec-2021	Active, not recruiting	32880602	R01CA226776
clinical_trial	NCT03287908	A Study to Assess AMG 701 Montherapy, or in Combination With Pomalidomide, With or Without, Dexamethasone in Subjects With Relapsed or Refractory Multiple Myeloma	18-Mar-2022	Recruiting	32898244	P01CA155258
clinical_trial	NCT04071366	A Study of Itacitinib for the Prevention of Cytokine Release Syndrome Induced by Immune Effector Cell Therapy	23-Mar-2022	Recruiting	32998963	P01CA214278
clinical_trial	NCT03837353	A Parallel Arm Phase 1b/2a Study of DKN-01 as Monotherapy or in Combination With Docetaxel for the Treatment of Advanced Prostate Cancer With Elevated DKK1	3-Mar-2022	Recruiting	33015525	U54CA224079
clinical_trial	NCT04302675	Adapting Motivational Interviewing for Maternal Immunizations (MI4MI) (MI4MI)	26-Jul-2021	Active, not recruiting	33203635	P50CA244688
clinical_trial	NCT00022737	Combination Chemotherapy With or Without Peripheral Stem Cell Transplant in Treating Children With Acute Lymphoblastic Leukemia	27-Feb-2014	Completed	33242441	U01CA232486
clinical_trial	NCT00287105	Safety and Efficacy of Imatinib Added to Chemotherapy in Treatment of Ph+ Acute Lymphoblastic Leukemia in Children (ESPHALL)	20-Oct-2017	Completed	33242441	U01CA232486
clinical_trial	NCT00720109	Dasatinib and Combination Chemotherapy in Treating Young Patients With Newly Diagnosed Acute Lymphoblastic Leukemia	13-Apr-2020	Completed	33242441	U01CA232486
clinical_trial	NCT01460160	Pediatric Philadelphia Positive Acute Lymphoblastic Leukemia	8-Dec-2021	Completed	33242441	U01CA232486
clinical_trial	NCT01423747	Allogeneic Stem Cell Transplantation in Children and Adolescents With Acute Lymphoblastic Leukaemia	26-Jun-2015	Unknown	33242441	U01CA232486
clinical_trial	NCT01423500	ALL-SCT BFM International- HSCT in Children and Adolescents With ALL (ALL-SCT-BFMi)	26-Jun-2015	Unknown	33242441	U01CA232486
clinical_trial	NCT01949129	Allogeneic Stem Cell Transplantation for Children and Adolescents With Acute Lymphoblastic Leukaemia	1-Oct-2020	Recruiting	33242441	U01CA232486
clinical_trial	NCT01117441	International Collaborative Treatment Protocol For Children And Adolescents With Acute Lymphoblastic Leukemia	20-Oct-2020	Active, not recruiting	33242441	U01CA232486
clinical_trial	NCT02066181	Sorafenib Tosylate in Treating Patients With Desmoid Tumors or Aggressive Fibromatosis	22-Mar-2022	Active, not recruiting	33258687	U01CA233046
clinical_trial	NCT02066181	Sorafenib Tosylate in Treating Patients With Desmoid Tumors or Aggressive Fibromatosis	22-Mar-2022	Active, not recruiting	34420143	U01CA233046
clinical_trial	NCT02906371	Study of the Tocilizumab Optimization Timing for CART19 Associated Cytokine Release Syndrome	2-Jul-2021	Completed	33417474	P01CA214278
clinical_trial	NCT01970358	A Phase I Study With a Personalized NeoAntigen Cancer Vaccine in Melanoma	9-Dec-2020	Completed	33479501	U24CA224331
clinical_trial	NCT02228096	Study of Efficacy and Safety of CTL019 in Pediatric ALL Patients (ENSIGN)	23-Nov-2020	Completed	33496754	P01CA214278
clinical_trial	NCT02058706	LHRH Analogue Therapy With Enzalutamide or Bicalutamide in Treating Patients With Metastatic Hormone Sensitive Prostate Cancer	3-Mar-2021	Active, not recruiting	33496795	P50CA186786
clinical_trial	NCT02254278	Reduced-Dose Intensity-Modulated Radiation Therapy With or Without Cisplatin in Treating Patients With Advanced Oropharyngeal Cancer	11-Mar-2022	Active, not recruiting	33507809	U24CA180803
clinical_trial	NCT02136134	Addition of Daratumumab to Combination of Bortezomib and Dexamethasone in Participants With Relapsed or Refractory Multiple Myeloma	25-Mar-2022	Active, not recruiting	33513030	P01CA155258
clinical_trial	NCT02076009	A Study Comparing Daratumumab, Lenalidomide, and Dexamethasone With Lenalidomide and Dexamethasone in Relapsed or Refractory Multiple Myeloma	25-Mar-2022	Active, not recruiting	33513030	P01CA155258
clinical_trial	NCT03224520	Smoker-to-Smoker (S2S) Peer Marketing and Messaging to Disseminate Tobacco Interventions	26-Mar-2021	Completed	33571687	P50CA244693
clinical_trial	NCT01497808	RADVAX&#8482;: A STRATIFIED PHASE I/II DOSE ESCALATION TRIAL OF HYPOFRACTIONATED RADIOTHERAPY FOLLOWED BY IPILIMUMAB IN METASTATIC MELANOMA	10-Aug-2021	Completed	33643689	P01CA210944
clinical_trial	NCT01822509	Ipilimumab or Nivolumab in Treating Patients With Relapsed Hematologic Malignancies After Donor Stem Cell Transplant	24-Jun-2021	Completed	33720354	U01DK124165
clinical_trial	NCT01822509	Ipilimumab or Nivolumab in Treating Patients With Relapsed Hematologic Malignancies After Donor Stem Cell Transplant	24-Jun-2021	Completed	33720354	U24CA224316
clinical_trial	NCT01822509	Ipilimumab or Nivolumab in Treating Patients With Relapsed Hematologic Malignancies After Donor Stem Cell Transplant	24-Jun-2021	Completed	33720354	U24CA224319
clinical_trial	NCT01822509	Ipilimumab or Nivolumab in Treating Patients With Relapsed Hematologic Malignancies After Donor Stem Cell Transplant	24-Jun-2021	Completed	33720354	U24CA224331
clinical_trial	NCT02206334	Stereotactic Body Radiation Therapy in Treating Patients With Metastatic Breast Cancer, Non-small Cell Lung Cancer, or Prostate Cancer	2-Mar-2022	Active, not recruiting	33885704	U24CA180803
clinical_trial	NCT02588456	Pilot Study of Autologous Anti-CD22 Chimeric Antigen Receptor Redirected T Cells In Patients With Chemotherapy Resistant Or Refractory Acute Lymphoblastic Leukemia	12-Jan-2018	Terminated	33888899	P01CA214278
clinical_trial	NCT02650414	CD22 Redirected Autologous T Cells for ALL	21-Jan-2022	Recruiting	33888899	P01CA214278
clinical_trial	NCT01804465	Sipuleucel-T With Immediate vs. Delayed Cytotoxic T-Lymphocyte-Associated Protein 4 (CTLA-4) Blockade for Prostate Cancer	18-Aug-2021	Completed	33986125	U01CA233100
clinical_trial	NCT01804465	Sipuleucel-T With Immediate vs. Delayed Cytotoxic T-Lymphocyte-Associated Protein 4 (CTLA-4) Blockade for Prostate Cancer	18-Aug-2021	Completed	33986125	U01CA244452
clinical_trial	NCT02501096	A Trial of Lenvatinib (E7080) Plus Pembrolizumab in Participants With Selected Solid Tumors	7-Mar-2022	Active, not recruiting	34039647	R01CA205426
clinical_trial	NCT03985852	Broadening the Reach, Impact, and Delivery of Genetic Services (BRIDGE)	27-Aug-2021	Enrolling by invitation	34078380	U01CA232826
clinical_trial	NCT00085735	Comparison of Radiation Therapy Regimens in Combination With Chemotherapy in Treating Young Patients With Newly Diagnosed Standard-Risk Medulloblastoma	2-Mar-2022	Active, not recruiting	34110925	U10CA180899
clinical_trial	NCT00085735	Comparison of Radiation Therapy Regimens in Combination With Chemotherapy in Treating Young Patients With Newly Diagnosed Standard-Risk Medulloblastoma	2-Mar-2022	Active, not recruiting	34110925	U24CA196173
clinical_trial	NCT00085735	Comparison of Radiation Therapy Regimens in Combination With Chemotherapy in Treating Young Patients With Newly Diagnosed Standard-Risk Medulloblastoma	2-Mar-2022	Active, not recruiting	34110925	U24CA180803
clinical_trial	NCT03607617	ASCEND: ApproacheS to CHC ImplEmeNtation of SDH Data Collection and Action (ASCEND)	15-Jun-2021	Active, not recruiting	34174834	P50CA244289
clinical_trial	NCT02054741	Geriatric Assessment Intervention for Reducing Toxicity in Older Patients With Advanced Cancer	7-Apr-2022	Completed	34272204	U01CA233167
clinical_trial	NCT02054741	Geriatric Assessment Intervention for Reducing Toxicity in Older Patients With Advanced Cancer	7-Apr-2022	Completed	34741815	U01CA233167
clinical_trial	NCT03233854	CD19/CD22 Chimeric Antigen Receptor(CAR) T Cells in Adults With Recurrent/Refractory B Cell Malignancies	21-Feb-2022	Recruiting	34312556	U54CA232568
clinical_trial	NCT02186847	Chemotherapy and Radiation Therapy With or Without Metformin Hydrochloride in Treating Patients With Stage III Non-small Cell Lung Cancer	23-Jun-2020	Active, not recruiting	34323922	U24CA180803
clinical_trial	NCT03971799	Study of Anti-CD33 Chimeric Antigen Receptor-Expressing T Cells (CD33CART) in Children and Young Adults With Relapsed/Refractory Acute Myeloid Leukemia	14-Oct-2021	Recruiting	34531250	U01CA232486
clinical_trial	NCT02478931	Study of Personalized Cancer Therapy to Determine Response and Toxicity (UCSD_PREDICT)	5-Apr-2021	Recruiting	34641956	U01CA217885
clinical_trial	NCT02355262	CATCH-UP Intervention in Increasing Cancer Screening and Prevention Care in Uninsured Patients at Community Health Centers	19-Aug-2020	Completed	34717616	P50CA244289
clinical_trial	NCT04258813	Onco-primary Care Networking to Support TEAM-based Care (ONE TEAM)	21-Mar-2022	Recruiting	34794388	R01CA249568
clinical_trial	NCT00980460	Risk-Based Therapy in Treating Younger Patients With Newly Diagnosed Liver Cancer	20-Jan-2022	Active, not recruiting	34874751	U10CA180899
clinical_trial	NCT00980460	Risk-Based Therapy in Treating Younger Patients With Newly Diagnosed Liver Cancer	20-Jan-2022	Active, not recruiting	34874751	U24CA180803
clinical_trial	NCT02888743	Durvalumab and Tremelimumab With or Without High or Low-Dose Radiation Therapy in Treating Patients With Metastatic Colorectal or Non-small Cell Lung Cancer	6-Jan-2022	Active, not recruiting	35033226	U24CA224316
clinical_trial	NCT02888743	Durvalumab and Tremelimumab With or Without High or Low-Dose Radiation Therapy in Treating Patients With Metastatic Colorectal or Non-small Cell Lung Cancer	6-Jan-2022	Active, not recruiting	35033226	U24CA224331
clinical_trial	NCT01514201	Veliparib, Radiation Therapy, and Temozolomide in Treating Younger Patients With Newly Diagnosed Diffuse Pontine Gliomas	13-Aug-2019	Completed	32009149	UM1CA081457
clinical_trial	NCT02847130	Identifying, Understanding, and Overcoming Barriers to the Use of Clinical Practice Guidelines in Pediatric Oncology	5-Sep-2021	Active, not recruiting	34530933	UG1CA189955
clinical_trial	NCT04239573	Comparing Two Methods to Follow Patients With Pancreatic Cysts	3-Jan-2022	Recruiting	32920242	UG1CA189828
clinical_trial	NCT02296684	Immunotherapy With MK-3475 in Surgically Resectable Head and Neck Squamous Cell Carcinoma	28-Apr-2022	Completed	32665297	U24CA237719
clinical_trial	NCT02296684	Immunotherapy With MK-3475 in Surgically Resectable Head and Neck Squamous Cell Carcinoma	28-Apr-2022	Completed	32665297	U01CA209936
clinical_trial	NCT01642251	Cisplatin and Etoposide With or Without Veliparib in Treating Patients With Extensive Stage Small Cell Lung Cancer	5-Feb-2019	Completed	32860331	UG1CA189828
clinical_trial	NCT01863550	Bortezomib or Carfilzomib With Lenalidomide and Dexamethasone in Treating Patients With Newly Diagnosed Multiple Myeloma	3-Jan-2022	Active, not recruiting	32866432	UG1CA189828
