type	clinical_trial_id	title	last_update_posted	recruitment_status	publication_id	queried_project_id
clinical_trial	NCT03257631	A Study of Pomalidomide Monotherapy for Children and Young Adults With Recurrent or Progressive Primary Brain Tumors	3-May-2022	Active, not recruiting	33025730	UM1CA081457
clinical_trial	NCT01606878	Crizotinib and Combination Chemotherapy in Treating Younger Patients With Relapsed or Refractory Solid Tumors or Anaplastic Large Cell Lymphoma	26-Feb-2019	Completed	33095287	UM1CA228823
clinical_trial	NCT01503515	Caspofungin Acetate, Fluconazole, or Voriconazole in Preventing Fungal Infections in Patients Following Donor Stem Cell Transplant	31-Jan-2022	Completed	33136159	UG1CA189955
clinical_trial	NCT01503515	Caspofungin Acetate, Fluconazole, or Voriconazole in Preventing Fungal Infections in Patients Following Donor Stem Cell Transplant	31-Jan-2022	Completed	33136159	U10CA180899
clinical_trial	NCT01190930	Risk-Adapted Chemotherapy in Treating Younger Patients With Newly Diagnosed Standard-Risk Acute Lymphoblastic Leukemia or Localized B-Lineage Lymphoblastic Lymphoma	8-Jun-2021	Active, not recruiting	33411585	U10CA180899
clinical_trial	NCT00025259	Chemotherapy With or Without Additional Chemotherapy and/or Radiation Therapy in Treating Children With Newly Diagnosed Hodgkin's Disease	12-Apr-2017	Completed	33512412	U10CA180899
clinical_trial	NCT00025259	Chemotherapy With or Without Additional Chemotherapy and/or Radiation Therapy in Treating Children With Newly Diagnosed Hodgkin's Disease	12-Apr-2017	Completed	34662378	U10CA180899
clinical_trial	NCT00346164	Observation, Radiation Therapy, Combination Chemotherapy, and/or Surgery in Treating Young Patients With Soft Tissue Sarcoma	28-Apr-2022	Completed	33548339	U10CA180899
clinical_trial	NCT00346164	Observation, Radiation Therapy, Combination Chemotherapy, and/or Surgery in Treating Young Patients With Soft Tissue Sarcoma	28-Apr-2022	Completed	33548339	U24CA180803
clinical_trial	NCT00346164	Observation, Radiation Therapy, Combination Chemotherapy, and/or Surgery in Treating Young Patients With Soft Tissue Sarcoma	28-Apr-2022	Completed	34623899	U10CA180899
clinical_trial	NCT00939770	Crizotinib in Treating Younger Patients With Relapsed or Refractory Solid Tumors or Anaplastic Large Cell Lymphoma	9-Jun-2020	Completed	33568345	UM1CA228823
clinical_trial	NCT01979536	Brentuximab Vedotin or Crizotinib and Combination Chemotherapy in Treating Patients With Newly Diagnosed Stage II-IV Anaplastic Large Cell Lymphoma	24-Feb-2022	Active, not recruiting	33684925	U10CA180899
clinical_trial	NCT02808650	Prexasertib in Treating Pediatric Patients With Recurrent or Refractory Solid Tumors	15-Apr-2021	Completed	33881209	UM1CA228823
clinical_trial	NCT03126916	Iobenguane I-131 or Crizotinib and Standard Therapy in Treating Younger Patients With Newly-Diagnosed High-Risk Neuroblastoma or Ganglioneuroblastoma	25-Aug-2021	Recruiting	34028986	U10CA180899
clinical_trial	NCT01175356	Induction Therapy Including 131 I-MIBG and Chemotherapy in Treating Patients With Newly Diagnosed High-Risk Neuroblastoma Undergoing Stem Cell Transplant, Radiation Therapy, and Maintenance Therapy With Isotretinoin	7-Mar-2022	Active, not recruiting	34028986	U10CA180899
clinical_trial	NCT01407757	Study of Gemtuzumab Ozogamicin Therapy in DNA Samples From Patients With Acute Myeloid Leukemia Treated on COG-AAML0531	19-May-2016	Completed	34048275	U10CA180899
clinical_trial	NCT02445391	Platinum Based Chemotherapy or Capecitabine in Treating Patients With Residual Triple-Negative Basal-Like Breast Cancer Following Neoadjuvant Chemotherapy	21-May-2020	Recruiting	34092112	UG1CA189828
clinical_trial	NCT00392327	Chemotherapy and Radiation Therapy in Treating Young Patients With Newly Diagnosed, Previously Untreated, High-Risk Medulloblastoma/PNET	6-Jan-2022	Active, not recruiting	34292305	U10CA180899
clinical_trial	NCT02444884	MLN8237 to Treat Children With Relapsed/Refractory Solid Tumors	9-Feb-2016	Completed	34435684	U10CA180899
clinical_trial	NCT01154816	Alisertib in Treating Young Patients With Recurrent or Refractory Solid Tumors or Leukemia	13-May-2020	Completed	34435684	U10CA180899
clinical_trial	NCT02180867	Radiation Therapy With or Without Combination Chemotherapy or Pazopanib Before Surgery in Treating Patients With Newly Diagnosed Non-rhabdomyosarcoma Soft Tissue Sarcomas That Can Be Removed by Surgery	29-Apr-2022	Active, not recruiting	34515544	U10CA180899
clinical_trial	NCT01516567	Intergroup Trial for Children or Adolescents With Primary Mediastinal Large B-Cell Lymphoma: DA-EPOCH-Rituximab Evaluation	18-Mar-2021	Active, not recruiting	34570655	U10CA180899
clinical_trial	NCT00372593	Combination Chemotherapy With or Without Gemtuzumab in Treating Young Patients With Newly Diagnosed Acute Myeloid Leukemia	24-Mar-2021	Completed	34596937	U10CA180899
clinical_trial	NCT01371981	Bortezomib and Sorafenib Tosylate in Treating Patients With Newly Diagnosed Acute Myeloid Leukemia	29-Apr-2022	Active, not recruiting	34596937	U10CA180899
clinical_trial	NCT01371981	Bortezomib and Sorafenib Tosylate in Treating Patients With Newly Diagnosed Acute Myeloid Leukemia	29-Apr-2022	Active, not recruiting	34855461	U10CA180899
clinical_trial	NCT01231906	Combination Chemotherapy in Treating Patients With Non-Metastatic Extracranial Ewing Sarcoma	23-May-2022	Active, not recruiting	34652968	U10CA180899
clinical_trial	NCT02339740	Tretinoin and Arsenic Trioxide in Treating Patients With Untreated Acute Promyelocytic Leukemia	24-Jan-2022	Active, not recruiting	34762093	U10CA180899
clinical_trial	NCT02339740	Tretinoin and Arsenic Trioxide in Treating Patients With Untreated Acute Promyelocytic Leukemia	24-Jan-2022	Active, not recruiting	34762093	U24CA196173
clinical_trial	NCT00980460	Risk-Based Therapy in Treating Younger Patients With Newly Diagnosed Liver Cancer	29-Apr-2022	Active, not recruiting	34874751	U10CA180899
clinical_trial	NCT00980460	Risk-Based Therapy in Treating Younger Patients With Newly Diagnosed Liver Cancer	29-Apr-2022	Active, not recruiting	34874751	U24CA180803
clinical_trial	NCT02823652	Pre-Test Genetic Education and Remote Genetic Counseling in Communicating Tumor Profiling Results to Patients With Advanced Cancer	2-Aug-2021	Completed	34890045	UG1CA189828
clinical_trial	NCT02981628	Inotuzumab Ozogamicin in Treating Younger Patients With B-Lymphoblastic Lymphoma or Relapsed or Refractory CD22 Positive B Acute Lymphoblastic Leukemia	29-Mar-2022	Active, not recruiting	35007127	U10CA180899
clinical_trial	NCT02981628	Inotuzumab Ozogamicin in Treating Younger Patients With B-Lymphoblastic Lymphoma or Relapsed or Refractory CD22 Positive B Acute Lymphoblastic Leukemia	29-Mar-2022	Active, not recruiting	35007127	U24CA196173
clinical_trial	NCT00945009	Combination Chemotherapy and Surgery in Treating Young Patients With Wilms Tumor	25-Mar-2022	Active, not recruiting	35072864	U10CA180899
clinical_trial	NCT00945009	Combination Chemotherapy and Surgery in Treating Young Patients With Wilms Tumor	25-Mar-2022	Active, not recruiting	35072864	U24CA196173
clinical_trial	NCT00433511	Doxorubicin Hydrochloride, Cyclophosphamide, and Paclitaxel With or Without Bevacizumab in Treating Patients With Lymph Node-Positive or High-Risk, Lymph Node-Negative Breast Cancer	18-May-2022	Active, not recruiting	35226083	UG1CA189828
